{"api_version":"1.0","data":{"delivery_manifest_path":"/workspace/Clients/Client/Projects/Project/05_Final_Delivery/delivery-manifest.json","delivery_notes_path":"/workspace/Clients/Client/Projects/Project/05_Final_Delivery/Delivery_Notes.md","delivery_path":"/workspace/Clients/Client/Projects/Project/05_Final_Delivery","manifest_path":"/workspace/Clients/Client/Projects/Project/00_Admin/project-manifest.json","project":{"id":"project-id","path":"/workspace/Clients/Client/Projects/Project"},"replacement_mode":"default","revision":{"number":1,"path":"/workspace/Clients/Client/Projects/Project/04_Revisions/Revision_01"},"workspace_path":"/workspace","would_update":["/workspace/Clients/Client/Projects/Project/00_Admin/project-manifest.json","/workspace/Clients/Client/Projects/Project/05_Final_Delivery"],"zip_requested":false},"errors":[],"operation":"delivery.create","status":"planned","warnings":[]}
