{"api_version":"1.0","operation":"delivery.create","status":"success","data":{"project":{"id":"project-id","path":"/workspace/project"},"manifest_path":"/workspace/project/00_Admin/project-manifest.json","delivery_path":"/workspace/project/05_Final_Delivery","delivery_notes_path":"/workspace/project/05_Final_Delivery/Delivery_Notes.md","delivery_manifest_path":"/workspace/project/05_Final_Delivery/delivery-manifest.json","revision":{"number":1,"path":"/workspace/project/04_Revisions/Revision_01"},"workspace_path":"/workspace","replacement_mode":"default","zip_requested":false,"files_delivered":2},"warnings":[],"errors":[]}
